{
  "request_id": "f1d-notes-u02-architecture-v1",
  "status": "PARTIAL",
  "results": {
    "inventory": [
      {
        "filename": "PROMPT_2026-07-22_133056(1).md",
        "bytes": 3337,
        "read_in_full": true
      },
      {
        "filename": "notes_architecture_u02_inputs.zip",
        "bytes": 256590,
        "read_in_full": true
      },
      {
        "filename": "DEFENSE_LEDGER.md",
        "bytes": 25898,
        "read_in_full": true
      },
      {
        "filename": "SPEAKER_NOTES_BUDGET.md",
        "bytes": 7290,
        "read_in_full": true
      },
      {
        "filename": "WEB_RESPONSE_SCHEMA.json",
        "bytes": 6810,
        "read_in_full": true
      },
      {
        "filename": "WEB_REVIEW_REQUEST.json",
        "bytes": 6230,
        "read_in_full": true
      },
      {
        "filename": "rev22_deck.pdf",
        "bytes": 190140,
        "read_in_full": true,
        "pages": 13
      },
      {
        "filename": "rev22_slide_text.md",
        "bytes": 16035,
        "read_in_full": true
      },
      {
        "filename": "thesis_flat.tex",
        "bytes": 162954,
        "read_in_full": true
      },
      {
        "filename": "thesis_tables.tex",
        "bytes": 39922,
        "read_in_full": true
      },
      {
        "filename": "u01_claim_ledger.md",
        "bytes": 14294,
        "read_in_full": true
      }
    ],
    "slide_architecture": [
      {
        "slide": 1,
        "one_job": "Orient the listener to the exact phenomenon the thesis studies.",
        "must_land": [
          "The unit is uncertainty in CEOs' unscripted Q&A answers.",
          "The event is an acquisition that is not yet public, with cash deals as the focal setting.",
          "The talk documents a descriptive language pattern rather than a causal mechanism."
        ],
        "cut_order": [
          "Name the research object: residual CEO Q&A uncertainty around undisclosed cash acquisitions.",
          "Clarify that the question concerns a pre-announcement language trace.",
          "State the descriptive, noncausal scope.",
          "Speak the degree, institution, and adviser details already visible on screen."
        ],
        "word_budget_ack": 65,
        "has_more_than_one_job": false,
        "next_slide_interface": "End with the unresolved question of why an undisclosed deal could change answers; Slide 2 must supply the disclosure bind."
      },
      {
        "slide": 2,
        "one_job": "Make the listener understand the disclosure bind that creates the prediction.",
        "must_land": [
          "The firm may hold material deal information while the routine earnings call still occurs.",
          "The firm may remain silent, but anything it does say cannot mislead.",
          "Hedged or qualified answers are a possible language trace while the deal remains private."
        ],
        "cut_order": [
          "Establish the private-information plus routine-Q&A bind.",
          "State the core prediction: residual Q&A uncertainty may rise while the deal is private.",
          "Preserve the boundary that the framework does not decide whether silence is constrained or strategic.",
          "Explain the legal authorities or disclosure-theory citations individually."
        ],
        "word_budget_ack": 150,
        "has_more_than_one_job": false,
        "next_slide_interface": "End with the prediction being tied to the private-information state; Slide 3 must show when that state ends and why payment method supplies a comparison."
      },
      {
        "slide": 3,
        "one_job": "Set the two empirical contrasts: the information clock versus the transaction clock, and cash versus stock.",
        "must_land": [
          "Announcement makes the information public, while completion is when cash leaves.",
          "Cash and stock deals share the disclosure setting.",
          "Stock deals add an equity-currency management incentive, which motivates comparison but does not identify a cause."
        ],
        "cut_order": [
          "Distinguish announcement from completion as two different clocks.",
          "Explain that cash and stock share the disclosure bind.",
          "State that the payment-method contrast is motivational and descriptive, not causal.",
          "Elaborate the prior literature on equity-currency management or cash accumulation."
        ],
        "word_budget_ack": 150,
        "has_more_than_one_job": true,
        "next_slide_interface": "End by naming timing and payment method as testable dimensions; Slide 4 must convert them into the three research questions."
      },
      {
        "slide": 4,
        "one_job": "Give the listener a three-question map for the rest of the talk.",
        "must_land": [
          "RQ1 asks whether residual uncertainty rises before cash-deal announcement.",
          "RQ2 asks whether uncertainty changes at announcement while cash changes at completion.",
          "RQ3 asks whether cash differs from stock using a direct difference test.",
          "All tests are descriptive within-firm comparisons, not causal estimates."
        ],
        "cut_order": [
          "State the three questions in appearance, timing, and payment-method order.",
          "Anchor all three in within-firm comparisons and the noncausal scope.",
          "Flag that the cash-minus-stock difference is tested directly.",
          "Read the equation-like labels or recite the full control list."
        ],
        "word_budget_ack": 150,
        "has_more_than_one_job": false,
        "next_slide_interface": "End by asking what is new about these three questions; Slide 5 must locate the missing literature cell before the empirical build begins."
      },
      {
        "slide": 5,
        "one_job": "Locate the thesis's narrow contribution relative to the nearest prior work.",
        "must_land": [
          "Prior work reads managed tone, strategy vocabulary, or prices.",
          "This thesis reads residual uncertainty in unscripted CEO Q&A before an unannounced acquisition.",
          "The novelty claim remains qualified as 'to our knowledge'."
        ],
        "cut_order": [
          "Define the missing cell using the three contrasts: uncertainty, Q&A, and the anticipatory window.",
          "Retain the 'to our knowledge' qualifier.",
          "Name the three adjacent literatures at category level.",
          "Describe each cited paper, author pair, and finding separately."
        ],
        "word_budget_ack": 120,
        "has_more_than_one_job": false,
        "next_slide_interface": "End with the exact empirical object now located; Slide 6 must show the data path capable of observing it."
      },
      {
        "slide": 6,
        "one_job": "Show where the evidence comes from and which firms it can represent.",
        "must_land": [
          "The base panel contains 88,205 calls from 1,884 firms over 2002-2018.",
          "Repeated calls and CEO identification are required to form the residual, narrowing the sample.",
          "The focal first-cash-deal test contains 27,622 firm-quarters from 1,248 firms.",
          "The sample tilts toward larger, better-covered U.S. public firms."
        ],
        "cut_order": [
          "Give the base panel, residual-feasible sample logic, and focal test sample.",
          "State the deal screen: known payment split, at least $1 million, and at least 50% for an arm.",
          "Disclose the larger-firm and better-covered selection boundary.",
          "Recite every database and every intermediate count."
        ],
        "word_budget_ack": 185,
        "has_more_than_one_job": false,
        "next_slide_interface": "End with the sample narrowing because the outcome must be constructed; Slide 7 must explain that construction."
      },
      {
        "slide": 7,
        "one_job": "Make the residual measure understandable without implying that it directly observes what the CEO knows.",
        "must_land": [
          "Raw uncertainty is the share of uncertainty words in CEO answers.",
          "Predictable components, especially persistent CEO speaking style, are removed.",
          "UncResCEO is the call-specific remainder, not raw uncertainty and not a direct measure of private knowledge.",
          "It is a generated outcome, so two-step standard-error uncertainty remains a limitation."
        ],
        "cut_order": [
          "Explain raw word share minus predictable components equals the residual.",
          "Emphasize removal of persistent CEO style and the call-specific interpretation.",
          "State the generated-regressand limitation without attempting the full rebuttal.",
          "List every first-stage control, sample statistic, and replication fit number."
        ],
        "word_budget_ack": 185,
        "has_more_than_one_job": false,
        "next_slide_interface": "End with the residual defined as the outcome carried forward; Slide 8 must show its first estimated pre-announcement shift."
      },
      {
        "slide": 8,
        "one_job": "Establish that the pre-announcement rise exists and communicate its size honestly.",
        "must_land": [
          "The within-firm estimate is +0.0461 with two-tailed p=0.0074.",
          "The estimate is about 15.3% of the residual's usual across-call standard deviation.",
          "The rise is modest but statistically clear and descriptive, not causal.",
          "The displayed interval is approximately derived from the estimate and standard error, not printed by the thesis."
        ],
        "cut_order": [
          "State the direction, estimate, and descriptive comparison.",
          "Translate magnitude as about 15% of the usual residual spread.",
          "Give one uncertainty indicator: p-value or approximate interval, without narrating both at length.",